{
  "schema_version": "v1",
  "reconciliation_id": "REC-0041",
  "candidate_id": "H-002",
  "outcome_id": "OL-0027",
  "outcome_kind": "research_oos",
  "pipeline_version": "pre_wp_5b",
  "expectation_source_type": "d2_006_gates",
  "expectation_source_artifact_id": "D2-006",
  "expectation_source_artifact_path": "docs/onboarding/PHASE2_BASELINE.md",
  "expectation_extracted": {
    "source_type": "d2_006_gates",
    "source_artifact_id": "D2-006",
    "source_artifact_path": "docs/onboarding/PHASE2_BASELINE.md",
    "extraction_method": "manual_forward_wp12dj_d2_006_rec_append_v1",
    "extracted_at": "2026-05-25T23:40:00Z",
    "metric_expectations": [
      {
        "metric_name": "sharpe",
        "expected_operator": "gte",
        "expected_value": 1.0,
        "expected_unit": null,
        "source_field_path": "D2-006.What changes[1]",
        "source_text": "Out-of-sample Sharpe >= 1.0 net of modeled costs."
      },
      {
        "metric_name": "dsr",
        "expected_operator": "gt",
        "expected_value": 1.0,
        "expected_unit": "95_percent_confidence_given_actual_trial_count",
        "source_field_path": "D2-006.What changes[2]",
        "source_text": "DSR > 1.0 at 95% confidence given actual trial count."
      },
      {
        "metric_name": "max_drawdown",
        "expected_operator": "lte",
        "expected_value": 0.2,
        "expected_unit": "fraction",
        "source_field_path": "D2-006.What changes[3]",
        "source_text": "Max drawdown <= 20% in any walk-forward fold."
      },
      {
        "metric_name": "sensitivity_min_ratio",
        "expected_operator": "gte",
        "expected_value": 0.7,
        "expected_unit": "ratio",
        "source_field_path": "D2-006.What changes[4]",
        "source_text": "Parameter sensitivity: +/-25% parameter shift keeps Sharpe within 70% of baseline."
      },
      {
        "metric_name": "cost_drag_fraction",
        "expected_operator": "lte",
        "expected_value": 0.5,
        "expected_unit": "fraction_of_gross_pnl",
        "source_field_path": "D2-006.What changes[5]",
        "source_text": "Cost drag <= 50% of gross PnL.",
        "notes": "Preserved from D2-006 but not compared because OL-0027.metrics.gross_pnl <= 0, so the cost_drag_fraction as a fraction of gross PnL is not semantically interpretable as a pass/fail ratio."
      },
      {
        "metric_name": "pnl_concentration_90d",
        "expected_operator": "lte",
        "expected_value": 0.6,
        "expected_unit": "fraction_of_total_pnl",
        "source_field_path": "D2-006.What changes[6]",
        "source_text": "No single 90-day window contributes > 60% of total PnL.",
        "notes": "Preserved from D2-006 but not compared because OL-0027.metrics does not include a 90-day contribution metric."
      },
      {
        "metric_name": "free_parameter_count",
        "expected_operator": "lte",
        "expected_value": 5,
        "expected_unit": "count",
        "source_field_path": "D2-006.What changes[7]",
        "source_text": "<= 5 free parameters.",
        "notes": "Preserved from D2-006 but not compared because REC v1 realized_metrics copy OL metrics and OL-0027 does not include free_parameter_count."
      },
      {
        "metric_name": "walk_forward_efficiency",
        "expected_operator": "gt",
        "expected_value": 0.5,
        "expected_unit": "ratio",
        "source_field_path": "D2-006.What changes[8]",
        "source_text": "Walk-forward efficiency (OOS/IS Sharpe ratio) > 0.5."
      }
    ]
  },
  "realized_metrics": {
    "source_field": "trial_log.oos_sharpe",
    "window_convention": "WP-12dj / WP-S2c-73 uses the prior contiguous local data-year evaluation window, 2024-04-12 through 2025-04-11, as H-002 combined R1+R2 cycle 2 after WP-12di cycle 1 used 2025-04-12 through 2026-04-11. Indicators are warmed up on prior available 4h history, but the backtest window starts flat with no pre-window position carry-in. The original H-002 REP-0003 evidence used a full-period retrospective posture, so strict non-overlap against that baseline is impossible; this report records explicit non-cloned bounded-window disclosure for additional REP evidence.",
    "sharpe": 1.2836100531356018,
    "max_drawdown": 1.0,
    "n_obs": 2176,
    "trades": 50,
    "hit_rate": 0.34,
    "profit_factor": 0.9128514890628174,
    "final_equity": 0.0,
    "total_pnl": -10000.0,
    "gross_pnl": -5471.8771627209935,
    "fees_paid": 3021.1506000000004,
    "slippage_paid": 1510.5753000000002,
    "funding_paid": -3.603062720999869,
    "cost_drag_fraction": -0.8275264050385419,
    "dsr": 1.0,
    "walk_forward_efficiency": 1.0,
    "gates_passed": 4,
    "gates_total": 8,
    "funding_events_applied": 1094,
    "config_sha256": "3d09293e07297c941e5e829beee9b9eadfac66d20943cb2ac65f2859deeeb850",
    "dataset_sha256": "9c52bdd9b90a5c4c3f3857ee39de6941f0bd6de038007dc712616f5d6618fb87",
    "dsr_note": "P(SR>1.0)=1.0000; SR benchmark=0.6368",
    "max_drawdown_peak": "2024-11-22 07:59:59.999000+00:00",
    "max_drawdown_trough": "2025-04-09 19:59:59.999000+00:00",
    "skipped_bars": 0,
    "sensitivity_min_ratio": 0.5635580577762792,
    "short_side_trades": 25,
    "short_side_net_pnl": -9027.306642721001,
    "long_side_trades": 25,
    "long_side_net_pnl": 1310.8768200000077,
    "trial_count_before_append": 26,
    "trial_count_after_append": 27
  },
  "comparison": {
    "metric_comparisons": [
      {
        "metric_name": "sharpe",
        "expected_value": 1.0,
        "realized_value": 1.2836100531356018,
        "delta_absolute": 0.2836100531356018,
        "delta_relative": 0.2836100531356018,
        "comparison_verdict": "met",
        "comparison_notes": "D2-006 requires out-of-sample Sharpe >= 1.0 net of modeled costs; OL-0027 records sharpe above that threshold."
      },
      {
        "metric_name": "dsr",
        "expected_value": 1.0,
        "realized_value": 1.0,
        "delta_absolute": 0.0,
        "delta_relative": 0.0,
        "comparison_verdict": "met",
        "comparison_notes": "D2-006 requires DSR above the applicable confidence gate; OL-0027 records dsr at 1.0."
      },
      {
        "metric_name": "max_drawdown",
        "expected_value": 0.2,
        "realized_value": 1.0,
        "delta_absolute": 0.8,
        "delta_relative": 4.0,
        "comparison_verdict": "not_met",
        "comparison_notes": "D2-006 requires max drawdown <= 20%; OL-0027 records max_drawdown above that threshold."
      },
      {
        "metric_name": "sensitivity_min_ratio",
        "expected_value": 0.7,
        "realized_value": 0.5635580577762792,
        "delta_absolute": -0.13644194222372075,
        "delta_relative": -0.19491706031960107,
        "comparison_verdict": "not_met",
        "comparison_notes": "D2-006 requires parameter sensitivity min_ratio >= 0.70; OL-0027 records sensitivity_min_ratio below that threshold."
      },
      {
        "metric_name": "walk_forward_efficiency",
        "expected_value": 0.5,
        "realized_value": 1.0,
        "delta_absolute": 0.5,
        "delta_relative": 1.0,
        "comparison_verdict": "met",
        "comparison_notes": "D2-006 requires walk-forward efficiency > 0.5; OL-0027 records walk_forward_efficiency above that threshold."
      }
    ]
  },
  "overall_verdict": "partially_met",
  "interpretation": "REC-0041 derives from OL-0027 and is the WP-S2c-73 H-002 d2_006_gates cycle 2 REC under approved combined R1+R2 methodology. It is exact-segment evidence only for H-002 / research_oos / pre_wp_5b / d2_006_gates, increasing that exact segment count from 2 to 3 and recording descriptive REC-5 floor evidence for this exact segment only. It does not complete H-002, complete A2C-002, authorize Path B, A2C-003, Phase 3, approval/readiness, lifecycle transition, policy, scoring, ranking/recommendation, paper-live/runtime, protected-path authority, broad floor crossing, or downstream authority. Cost-drag is preserved but not deterministically compared because OL-0027.metrics.gross_pnl <= 0 makes cost_drag_fraction semantically uninterpretable as a pass/fail ratio. OL-0027 is reused by the sibling H-002 REC for the separate expectation source under R1 paired-source reuse; separate REC artifacts and separate expectation-source comparisons preserve exact-segment separation.",
  "derivation_record": {
    "derivation_method": "manual_forward_wp12dj_d2_006_rec_append_v1",
    "source_artifact_id": "OL-0027",
    "source_artifact_path": "research/outcome_ledgers/OL-0027.outcome_ledger.json",
    "source_outcome_id": "OL-0027",
    "expectation_source_type": "d2_006_gates",
    "derivation_timestamp": "2026-05-25T23:40:00Z",
    "tool_version": "wp12dj_manual_d2_006_rec_append_v1"
  },
  "retrospective_flag": false,
  "linked_advisory_artifacts": [],
  "linked_lifecycle_artifacts": [],
  "notes": "WP-12dj creates REC-0041 from new committed OL-0027 against committed D2-006 expectations. It moves H-002 / research_oos / pre_wp_5b / d2_006_gates from reconciliation_count = 2 to 3, meeting the REC-5 count floor for this exact segment only. The same source OL supports the sibling expectation-source REC under approved R1 paired-source reuse, with separate expectation-source comparison and exact-segment counting. The combined R1+R2 package is atomic and creates no H-002 completion, A2C-002 completion, Path B, A2C-003, Phase 3, schema, validator, central query-layer, bridge-code, bridge-output, config, dependency, data, runtime, policy, scoring, ranking/recommendation, approval, promotion, demotion, readiness, lifecycle transition, protected-path authority, or downstream authority."
}
